course_id,title,description,category,difficulty,rating,num_ratings,source,url
dmathgen,This,这是一门关于离散数学的入门级课程，对于理解一些在数据结构、算法、图论等计算机理论中经常出现的基本概念是很有帮助的。 great course！ 课很好，当我以为自己听的很懂时，做了quiz发现还是有很多问题，这也让我不断调整自己的学习方式。就是本人是个无敌惫懒货色。。。所以拖着的巨大课程量只能转班次了。。。 挺丰富的一份基础课程，收获颇多。 讲的很好，能够免费的传播知识，这是个很伟大的事情 Thi...,Computer Science,Intermediate,5.0,8,Coursera,https://www.coursera.org/learn/dmathgen
dna-analysis,Dna Analysis,The content is so good.  Wonderful course for anyone who wants to explore bioinformatics.  I really liked the programming assignments,Computer Science,Beginner,4.49,37,Coursera,https://www.coursera.org/learn/dna-analysis
dna-mutations,Dna Mutations,good One of the best specialization on Coursera.  Highly recommended for anyone who wants to apply his/her programming skills to fascinating real-world problems.,Computer Science,Intermediate,4.5,2,Coursera,https://www.coursera.org/learn/dna-mutations
dna-sequencing,Dna Sequencing,Great but too short.  I realize that it is hard to know where to start the course from but it is true that the Introductory Course for the Genomics Specialization has a lot of over lapping material.  ...,Computer Science,Beginner,4.88,40,Coursera,https://www.coursera.org/learn/dna-sequencing
dog-emotion-and-cognition,Dog Emotion And Cognition,Very interesting approach and a very dynamic and positive teacher!A must for all dog lovers! The course was informative and I really enjoyed through out.  Is a great course if you want to understand h...,Computer Science,Advanced,4.58,399,Coursera,https://www.coursera.org/learn/dog-emotion-and-cognition
dopage,Cours,Cours très intéressant et bien fait.  C'était un plaisir Excellent course! Cours très intéressant qui donne une vision globale du dopage dans le sport aussi bien psychologique que juridique et scienti...,Computer Science,Intermediate,5.0,7,Coursera,https://www.coursera.org/learn/dopage
doping,Very,Very good and well structured course.  Very usefull and interesting interviyu It really opens your mind and gives you a better understanding of a very complex topic that is doping Very specific course...,Computer Science,Advanced,4.5,16,Coursera,https://www.coursera.org/learn/doping
droits-de-lhomme,Droits De Lhomme,"Excelente, muy completo, una excelente oportunidad para perfeccionarte.  Exelente Excelente curso! Muchas gracias!!! Cours très intéressant et passionant, donné par professeurs compétents, qui parte d...",Computer Science,Beginner,4.86,105,Coursera,https://www.coursera.org/learn/droits-de-lhomme
drug-commercialization,Drug Commercialization,I learned a lot of new information that will be helpful in my future career path.  Well-organized industrial know-hows and useful concepts of business model This is yet another brilliant module by Dr....,Computer Science,Advanced,4.8,5,Coursera,https://www.coursera.org/learn/drug-commercialization
drug-development,Drug Development,It's amazing experience.  I had the opportunity to get access to new knowledge Brilliant framework and well designed structure Great Class.  We need more of these courses,Computer Science,Intermediate,4.8,5,Coursera,https://www.coursera.org/learn/drug-development
drug-discovery,Drug Discovery,Learned the trend of latest Pharma industry and review the basic concepts in drug discovery The course presents the basic concepts of DD and allows familiarization with the technical terms of the fiel...,Arts & Design,Beginner,4.63,19,Coursera,https://www.coursera.org/learn/drug-discovery
dsp,The,"too brief to learn Excellent teaching of digital signal processing theory and techniques.  Even form an engineering student who already has most on the material, is a very good review source.  Good on...",Computer Science,Advanced,4.74,19,Coursera,https://www.coursera.org/learn/dsp
duke-behavioral-finance,Duke Behavioral Finance,"While the topic is interesting, the materials are poor and the lectures are not particularly insightful.  The slides have several mistakes and typos, which makes you doubt the whole course.  The speak...",Business,Beginner,4.0,66,Coursera,https://www.coursera.org/learn/duke-behavioral-finance
duke-programming-web,Duke Programming Web,It's good for learning the basics.  I'm a true beginner so it's perfect for me.  Exceptionally awesome course which teaches the basics of front end development Concentrated on image manipulation which...,Computer Science,Beginner,4.24,511,Coursera,https://www.coursera.org/learn/duke-programming-web
dwdesign,The,A lot of content. .,Computer Science,Beginner,4.27,81,Coursera,https://www.coursera.org/learn/dwdesign
dwrelational,It,I loved the SQL lessons in this course.  There were lots of examples to practice.  Awesome! Good Very useful The course was very helpful excellent course content and structure Great Good course Well d...,Computer Science,Advanced,4.45,33,Coursera,https://www.coursera.org/learn/dwrelational
dynamical-modeling,Dynamical Modeling,Very interesting course: I'm a Computer Engineer and I found very interesting the lessons about bistability and about stochastic modelling.  This is a amazing course.  I've learned a lot and all the k...,Data Science,Beginner,4.61,18,Coursera,https://www.coursera.org/learn/dynamical-modeling
dynamics,Excellent,"very good, I like this course, It teach me many knowledge about dynamics.  The best course I have taken.  Totally recommended for those who want to improve their knowledge in dynamics",Engineering,Beginner,4.94,18,Coursera,https://www.coursera.org/learn/dynamics
dyslexia-difficulties,Dyslexia Difficulties,Its really helpful to learn such course from coursers.  Amazing experience :) I have learned so much.  I hope I can help some kids around here,Computer Science,Advanced,4.79,76,Coursera,https://www.coursera.org/learn/dyslexia-difficulties
e-learning,E Learning,This course is excellent for any student who dreams of e-Learning in America!,Education,Intermediate,5.0,1,Coursera,https://www.coursera.org/learn/e-learning
early-vertebrate-evolution,Early Vertebrate Evolution,"Excelent Very in-depth, an excellent starting course for paleontology and prehistory education.  excelente! creo que nunca había comprendido realmente la evolución, fue una experiencia maravillosa, in...",Education,Beginner,4.79,58,Coursera,https://www.coursera.org/learn/early-vertebrate-evolution
earth-amnh,Earth Amnh,"Great course on geology I enjoyed taking this course, very simple and clear information.  Videos are very well-designed and informative very useful course.  great course The lessons were pretty good a...",Arts & Design,Beginner,4.3,23,Coursera,https://www.coursera.org/learn/earth-amnh
earth-climate-change,Earth Climate Change,I have learned the basics of climate science and gained a deeper understanding of climate change.  I feel better prepared to have conversations about the state of our planet and to attempt to enact po...,Education,Beginner,4.59,44,Coursera,https://www.coursera.org/learn/earth-climate-change
ebola-essentials-for-health-professionals,Ebola Essentials For Health Professionals,exciting course with skilled design Es una gran oportunidad para descubrir y aprender todo lo relativo a una enfermedad altamento compleja y que podria poner en juego la salud del mundo.  Me ha gustad...,Computer Science,Beginner,4.9,31,Coursera,https://www.coursera.org/learn/ebola-essentials-for-health-professionals
ebola-vaincre-ensemble,Ebola Vaincre Ensemble,EXCELLENT COURS The obstacle of not knowing French is quite detrimental T Très bon MOOC qui comprend une grande diversité de sujets.  A broad collection of different subjects.  But only a part of it m...,Computer Science,Intermediate,3.78,9,Coursera,https://www.coursera.org/learn/ebola-vaincre-ensemble
ebola-virus,Ebola Virus,Excelente curso.  This make you and Ebola Expert in just one month Very good material.,Computer Science,Beginner,4.59,22,Coursera,https://www.coursera.org/learn/ebola-virus
eclipse,Weeks,"The Course was great, except for two things.  one it was too short :-), and two, the peer graded projects were confusing.  If you are interested in viewing the eclipse you need this class",Computer Science,Intermediate,4.5,2,Coursera,https://www.coursera.org/learn/eclipse
ecologie,Je,"Cours très bien fait, très clair.  Idéal pour une première sensibilisation aux enjeux écologiques.  Very interesting course! Un cours excellent, très bien expliqué avec un très bon contenu",Computer Science,Intermediate,4.85,20,Coursera,https://www.coursera.org/learn/ecologie
ecologie-politique,Ecologie Politique,This course gave me a great understanding of the history of political ecology ; it's also a clear introduction to the current total depletion of resources and to the transformation the earth system is...,Computer Science,Beginner,5.0,3,Coursera,https://www.coursera.org/learn/ecologie-politique
economic-growth-part-1,Economic Growth Part 1,"This course opened my eyes to many issues.  It's really my first course in what I'd call, economics.  Great subject, (more than) perfect teacher ! I very much enjoyed this course",Data Science,Beginner,4.77,13,Coursera,https://www.coursera.org/learn/economic-growth-part-1
economic-growth-part-2,Economic Growth Part 2,"Great course! This course is great.  It's obviously tougher than the Part 1, though not exactly a follow up on the first part, as it covers different areas.  The course content is such that it did not...",Arts & Design,Beginner,3.67,3,Coursera,https://www.coursera.org/learn/economic-growth-part-2
economic-policy,Economic Policy,"Thank youhopefully.  it gives more pop up quiz.  So, it can reduce boring good course with great stuff Well explained course that makes economics intuitive! One of the few courses I REALLY liked",Computer Science,Beginner,4.84,116,Coursera,https://www.coursera.org/learn/economic-policy
economics-transition-emerging-markets,Economics Transition Emerging Markets,"Excellent explanation and transition overview of how economics are growing.  However, I was not from proper economic background and so Faced some difficulties in understanding special terms used such ...",Computer Science,Advanced,3.33,3,Coursera,https://www.coursera.org/learn/economics-transition-emerging-markets
economie-sol-immobilier-1,Economie Sol Immobilier 1,"Cours assez dur mais très intéressant.  Largement théorique mais proposant des applications pratiques, notamment dans les exercices.  Très intéressant ! j'ai hate de suivre la 2° partie Cours de très ...",Computer Science,Beginner,4.73,15,Coursera,https://www.coursera.org/learn/economie-sol-immobilier-1
economy-russia-transition,Economy Russia Transition,"This is one of the best courses which you can approach to understanding Russian economics, particularly its contemporary challenges and also a bridge to know the transition era! A very well structured...",Computer Science,Beginner,4.38,8,Coursera,https://www.coursera.org/learn/economy-russia-transition
ecosystem-services,Ecosystem Services,Very insightful and detailed.  Perfect spoken and written English Really interesting and useful course to obtain great insights of the Ecosystem Services approach.,Computer Science,Intermediate,4.5,2,Coursera,https://www.coursera.org/learn/ecosystem-services
edinburgh-music-theory,Edinburgh Music Theory,"Very challenging course, but I came away with far more knowledge than I entered it with.  A great course very educative and valuable! The information in the videos was very interesting and well presen...",Computer Science,Beginner,4.29,76,Coursera,https://www.coursera.org/learn/edinburgh-music-theory
educacion-superior,Educacion Superior,"Excelente, muy buen curso, espero sigan sacando más cursos de estos. .",Computer Science,Intermediate,4.64,55,Coursera,https://www.coursera.org/learn/educacion-superior
effective-content-strategy,Effective Content Strategy,Presenters with deep multiple layers of experience and confidence in their value.  Clarity of highlighting specific points for presentations of this length.  Obvious each person could spend days speak...,Arts & Design,Beginner,4.0,12,Coursera,https://www.coursera.org/learn/effective-content-strategy
effective-intercultural-communication,Effective Intercultural Communication,"The methodology taught was awesome.  I, being an Indian benefited a lot, truly.  It was another platform to interact globally",Computer Science,Intermediate,4.67,3,Coursera,https://www.coursera.org/learn/effective-intercultural-communication
effectuation,Je,"Le contenu est concis et clair, un très bon MOOC.  Dommage que les Quizz n'étaient pas accessibles au parcours libre.  Très bon cours",Computer Science,Intermediate,4.55,20,Coursera,https://www.coursera.org/learn/effectuation
egypt,Excelente,Otimo Excelente curso de introducción a la Egiptología.  Aporta muy buenas bases para iniciarse en el estudio de la civilización Egipcia antigua para quienes a futuro piensan tomar la Egiptología como...,Computer Science,Beginner,4.95,82,Coursera,https://www.coursera.org/learn/egypt
ehealth,Very,"A lot of information about eHealth Handled in very accurate way, with real life examples not only theory.  Very informative and interesting course with well substantiated real life examples.  It was f...",Computer Science,Advanced,4.43,7,Coursera,https://www.coursera.org/learn/ehealth
einstein-relativity,Einstein Relativity,"This was not just a course, but an experience in learning.  The professor took us through a journey of learning about a topic very difficult understand, and patiently led us through the learning exper...",Science,Beginner,4.79,92,Coursera,https://www.coursera.org/learn/einstein-relativity
ekonometrika,Ekonometrika,"Отличный преподаватель.  Очень хороший курс для тех, кто входит в ""Эконометрику"" и осваивает инструментарий R.  Спасибо авторам",Computer Science,Intermediate,5.0,23,Coursera,https://www.coursera.org/learn/ekonometrika
ekonomicheskaya-sociologiya,Ekonomicheskaya Sociologiya,"Отличный курс - понятный, доступный, интересный.  Курс был полезен , ставлю 4 , слушать было скучно Начало скучновато, но затем затягивает.  Очень интересно! Очень интересный курс, но плохо, что нет о...",Computer Science,Intermediate,4.77,13,Coursera,https://www.coursera.org/learn/ekonomicheskaya-sociologiya
ekonomika-dlya-neekonomistov,Ekonomika Dlya Neekonomistov,"Очень познавательно.  На некоторые вещи стал смотреть другими глазами.  Не легко, но очень интересно",Computer Science,Beginner,4.95,40,Coursera,https://www.coursera.org/learn/ekonomika-dlya-neekonomistov
elearning,The,"Overall, it was an interesting course that touched upon various learning/teaching strategies.  The course is relevant in the present times of digital transformation sweeping the globe.  As responsible...",Education,Intermediate,4.5,4,Coursera,https://www.coursera.org/learn/elearning
electric-utilities,Electric Utilities,very interesting!,Computer Science,Intermediate,5.0,1,Coursera,https://www.coursera.org/learn/electric-utilities
electrones-en-accion,Electrones En Accion,Excelente el curso lo definitivo para aprender en linea. .,Computer Science,Beginner,4.79,364,Coursera,https://www.coursera.org/learn/electrones-en-accion
electronic-converters,Electronic Converters,"great course!!, I bet a lot of people will be interested into a second part to this course!!, keep up the good work Very impressive fundamentals of magnetic components! very useful Quite intriguing wi...",Computer Science,Beginner,4.84,19,Coursera,https://www.coursera.org/learn/electronic-converters
electronics,It,"Thank you, It was such a great experience, I learned a lot.  Excelente curso, uma versão diferente na explicação e no conteúdo.  very good course, objective and very well explained It's a good approac...",Engineering,Beginner,4.76,46,Coursera,https://www.coursera.org/learn/electronics
electrostatica,Electrostatica,"Очень конструктивный курс.  Материал излагается очень понятно, разбираются все необходимые задачи.  К каждой теме есть демонстрации, что тоже не может не радовать",Computer Science,Intermediate,5.0,3,Coursera,https://www.coursera.org/learn/electrostatica
elementy-atomnoj-i-yadernoj-fiziki,Elementy Atomnoj I Yadernoj Fiziki,"Очень понравилось представление материала.  С удовольствием прослушала и порешала задачки, хоть в профессионально деятельности эти знания и не востребованы Очень обширный, но местами хотел более подро...",Computer Science,Beginner,4.71,14,Coursera,https://www.coursera.org/learn/elementy-atomnoj-i-yadernoj-fiziki
ell-assessment,Ell Assessment,"Another interesting course.  It offers a wide range of resources and content, and the learning outcomes and objectives are clear.  Very informative and helpful in assisting teachers with learning how ...",Computer Science,Intermediate,4.76,17,Coursera,https://www.coursera.org/learn/ell-assessment
ell-families,Ell Families,"Informative, but not as involved as the previous ELL courses.  I truly enjoyed this course.  As a speech-language pathologist, learning how to work with ELLs and their families was especially helpful ...",Computer Science,Intermediate,4.75,8,Coursera,https://www.coursera.org/learn/ell-families
ell-lesson,Ell Lesson,"A very informative, helpful, well-thought, very well-structured course, providing with knowledge, very good supplemental materials, visuals, examples.  Thank you very much for such interesting and use...",Education,Advanced,4.69,26,Coursera,https://www.coursera.org/learn/ell-lesson
embedded-operating-system,Embedded Operating System,"NOT GOOD. . REALLY BORING Good Introduction to Embedded Systems and operating systems, discuss interesting topics and the architecture of OS, a little hard and challenging but it worth it",Computer Science,Beginner,3.06,17,Coursera,https://www.coursera.org/learn/embedded-operating-system
emergence-of-life,Emergence Of Life,"Different, fun approach.  Basic science.  Excellent lectures",Computer Science,Beginner,2.86,7,Coursera,https://www.coursera.org/learn/emergence-of-life
emergent-phenomena,Emergent Phenomena,"I've learned a lot about emergent phenomena on this course.  All the topics are quite interesting and surprising (and I mean every one of them), but all are treated like popular science with little in...",Science,Intermediate,4.5,8,Coursera,https://www.coursera.org/learn/emergent-phenomena
emerging-technologies-capstone,Emerging Technologies Capstone,Well designed and well taught.  Great learning for Novice The Virtual Machine Experiment was very difficult to implement because the instructors' format did not allowenough detailed instruction specif...,Computer Science,Advanced,3.5,2,Coursera,https://www.coursera.org/learn/emerging-technologies-capstone
emotional-intelligence-leadership,Emotional Intelligence Leadership,"I really enjoyed this course.  Be prepared though that some of the assignments take substantial time to prepare, interviewing others.  Don't just assume that each 'week' in the course plan will take y...",Computer Science,Advanced,4.59,58,Coursera,https://www.coursera.org/learn/emotional-intelligence-leadership
emotions,It,"The material covered in the course is adequate and relevant to various aspects to our social lives.  The course's purpose is to get you acquainted with the broad field of emotion study, to pique curio...",Computer Science,Advanced,4.0,13,Coursera,https://www.coursera.org/learn/emotions
employee-performance,Employee Performance,Larry is awesome! I loved this course.  Very helpful with my position amazing course and amazing instructor I am Mariam Qavtaradze and I want to say thanks to Lary and to all team who gave me the chan...,Computer Science,Advanced,4.77,30,Coursera,https://www.coursera.org/learn/employee-performance
empreendedorismo,Muito,"Excellent real business cases and the course stays interesting all the time.  Muito boa visão geral do Empreendedorismo e seus desafios.  Excelente curso, os tópicos são abordados de forma clara e pra...",Computer Science,Intermediate,4.82,74,Coursera,https://www.coursera.org/learn/empreendedorismo
emprender,Este,"Este curso explica breve mente los principales aspectos que debemos tomar en cuenta al iniciar un negocio, desde la alta en hacienda y como sera registrado como autónomo o sociedad anónima o cooperati...",Computer Science,Intermediate,4.5,10,Coursera,https://www.coursera.org/learn/emprender
empresas-alimentos-bebidas,Empresas Alimentos Bebidas,"excelente Muy profesional y didáctico el curso.  El contenido que presenta superó muchos mis expectativas, logrando motivarme incursionar a profundidad en esta industria.  Recomendado! Excelente curso...",Computer Science,Beginner,4.89,44,Coursera,https://www.coursera.org/learn/empresas-alimentos-bebidas
energy-101,Energy 101,I thoroughly enjoyed this course.  It was very informative.  I would like to see more up-to-date data incorporated (I did this course in 2017 and the data used was current to 2013),Computer Science,Beginner,3.91,75,Coursera,https://www.coursera.org/learn/energy-101
energy-business,Energy Business,"This course is perfect for gaining a broad perspective on global energy markets.  It also delivers useful tools for analyzing political issues, strategic business decisions, and energy markets.  Very ...",Computer Science,Beginner,4.54,50,Coursera,https://www.coursera.org/learn/energy-business
engagement-strategy,Engagement Strategy,I really appreciate that the instructors have strong journalistic backgrounds—truly helpful for impactful writing! Filled with valuable content for helping professionals do better at strategically cre...,Computer Science,Beginner,4.36,25,Coursera,https://www.coursera.org/learn/engagement-strategy
engineering-mechanics-statics,Engineering Mechanics Statics,very good This is a great introduction to Engineering but make sure you know your physics (and some maths)As someone who hasn't done physics and math for about ten years I was struggling and I spent m...,Engineering,Beginner,4.78,155,Coursera,https://www.coursera.org/learn/engineering-mechanics-statics
engineering-mechanics-statics-2,Engineering Mechanics Statics 2,"very good course.  One thing, the 7 days to retake the exam, I see it is long time Fantastic overview of Mech-E work.  The Applications in Engineering Mechanics course is a must for any engineer",Education,Beginner,4.79,39,Coursera,https://www.coursera.org/learn/engineering-mechanics-statics-2
engineeringandroidapps,Android,"This course is excellent to learn, from scratch, how to write Unit and Integration tests, also you'll learn why, how and when to apply testing and security to your projects.  You'll learn to use JUnit...",Computer Science,Beginner,4.0,9,Coursera,https://www.coursera.org/learn/engineeringandroidapps
english-communication-capstone,English Communication Capstone,Awesome Those courses are very well prepared.  The instructor are clear and concise.  The practice is super good for self-evaluation prospective,Computer Science,Intermediate,4.33,6,Coursera,https://www.coursera.org/learn/english-communication-capstone
english-composition,English Composition,"English Composition I is an extremely detailed, comprehensive, easy-to-follow and well-thought-out course to help aspiring writers as well as academicians.  Dr.  Denise Comer, the course instructor, h...",Computer Science,Advanced,4.74,34,Coursera,https://www.coursera.org/learn/english-composition
english-for-business-project,English For Business Project,This training is really useful for everybody.,Data Science,Intermediate,5.0,1,Coursera,https://www.coursera.org/learn/english-for-business-project
english-for-business-writing,English For Business Writing,In my view this course is well structured and it focuses on business topics.  I highly recomend do it.  I'm an spanish native speaker and in my opinion with B1/B2 level you can follow it without any p...,Computer Science,Beginner,4.07,15,Coursera,https://www.coursera.org/learn/english-for-business-writing
english-principles,English Principles,Thank you so much for instructing Ana Pelayo.  Excellent foundation course; particularly helpful was the use of metaphors.  The weekly essays were thoughtful statements that encouraged reflection on w...,Arts & Design,Beginner,4.85,692,Coursera,https://www.coursera.org/learn/english-principles
ensino-hibrido,Ensino Hibrido,"Muito interessante e didático Excelente.  Desenvolvido em um ritmo compatível para professores conciliarem com sua carga de trabalho, possui conteúdo desenvolvido com boa didática e informações import...",Computer Science,Beginner,4.79,28,Coursera,https://www.coursera.org/learn/ensino-hibrido
entender-diseno,Entender Diseno,"Excelente curso, desde las presentaciones hasta las lecturas.  Bastante sencillo de entender, y con gran contenido Sin duda un curso que da muchas aportaciones interesantes en el mundo del diseño, esp...",Computer Science,Beginner,4.89,53,Coursera,https://www.coursera.org/learn/entender-diseno
