course_id,title,description,category,difficulty,rating,num_ratings,source,url
ios-jogos,Ios Jogos,"Ótimo curso, muito bem explicável! Alto recomendo.  Excelente curso, estou muito feliz, o professor ensina de maneira muito clara e objetiva, explica com calma, bem detalhado muito top, não vejo a hor...",Computer Science,Intermediate,5.0,3,Coursera,https://www.coursera.org/learn/ios-jogos
iosswift,Swift,"Week 4 is very bad!Bad quality of video. Bad speaker.  The videos were very tedious and convoluted, in addition to being outdated",Computer Science,Beginner,3.58,19,Coursera,https://www.coursera.org/learn/iosswift
iot,Very,Excellent Awesome Experience The professor teaches very well.  I like the way by which he starts from and basics and use real life examples.  Thank you :) Very basic,Computer Science,Beginner,4.5,476,Coursera,https://www.coursera.org/learn/iot
iot-architecture,Iot Architecture,"This course provide a lot of references, it is well organized, although maybe you will need more to do it than the time estimated.  Good, broad introduction to serious embedded systems.  It covers qui...",Computer Science,Beginner,3.4,5,Coursera,https://www.coursera.org/learn/iot-architecture
iot-augmented-reality-technologies,Iot Augmented Reality Technologies,excellent!! It is a comprehensive one covering breadth of IoT and related concepts He teaches even worse then me.  This course has no practical example.  It's just introduction(from start to end),Computer Science,Beginner,3.65,134,Coursera,https://www.coursera.org/learn/iot-augmented-reality-technologies
iot-connectivity-security,Iot Connectivity Security,"I wish there was something more interactive than videos and multiple choice questions. Maybe a simulation software or something fun like that.  This was not an easy course by any means, but it was an ...",Computer Science,Beginner,4.25,4,Coursera,https://www.coursera.org/learn/iot-connectivity-security
iot-cyber-security,Iot Cyber Security,"Very interesting and useful course Very educational, I learned a lot.  The course is well organized with enough reading materials.  Awesome!!! A Very Good Course with rich contents and materials",Data Science,Beginner,4.28,36,Coursera,https://www.coursera.org/learn/iot-cyber-security
iot-devices,Iot Devices,Its a Difficult one.  I think less of reading work and more video lectures should be included.  The course curriculum is good but the last two quizzes were not properly organized,Arts & Design,Advanced,3.33,6,Coursera,https://www.coursera.org/learn/iot-devices
iot-software-architecture,Iot Software Architecture,Very good course and material.  Can be downloaded and read again .  Good course Nice course,Computer Science,Beginner,3.67,15,Coursera,https://www.coursera.org/learn/iot-software-architecture
israel,The,O Curso é excelente.  Apresenta um panorama geral do Estado de Israel e dos processos que o tornaram o que é hoje.  Muito bom poder aprender com importantes professores da Universidade Hebraica de Jer...,Computer Science,Beginner,4.67,9,Coursera,https://www.coursera.org/learn/israel
istoriya-ekonomicheskoy-mysli,Istoriya Ekonomicheskoy Mysli,"Великолепный курс! Спасибо лекторам! Лучший курс ВШЭ экономической тематики.  Единственный курс, который благодаря ретроспективе дает понять, насколько были и остаются несовершенными экономические тео...",Computer Science,Intermediate,5.0,4,Coursera,https://www.coursera.org/learn/istoriya-ekonomicheskoy-mysli
istoriya-izobretenii-i-otkritii,Istoriya Izobretenii I Otkritii,"Очень интересно и понятно.  Спасибо! Надеюсь встретить новые курсы этих авторов.  Курс интересен для общего образования, но чрезмерно насыщен (3 недели ежедневно без перерывов - перебор)",Computer Science,Intermediate,4.75,8,Coursera,https://www.coursera.org/learn/istoriya-izobretenii-i-otkritii
it-project-management,It Project Management,"The Course was Too Good , A good understanding for the Project Management in terms of business thinking , It seemed that phase of classes was little bit fast , recommend to add more guest lectures,int...",Business,Intermediate,4.33,6,Coursera,https://www.coursera.org/learn/it-project-management
java-chengxu-sheji,Java Chengxu Sheji,"Worthy The topics in this course are all useful for a Java developer.  The learner should not only learn from the videos and the sample programs, but also the reference resources introduced by the tea...",Computer Science,Beginner,4.2,15,Coursera,https://www.coursera.org/learn/java-chengxu-sheji
java-for-android,Java For Android,"Nice course, but so more unused code in examples this course is for very beginner in java or in coding so recommended this course to only those who are beginner otherwise it is good if you loose your ...",Computer Science,Beginner,4.2,121,Coursera,https://www.coursera.org/learn/java-for-android
java-poo,Java Poo,"Un cours très riche et complet, aborde plusieurs concepts de la programmation orientée objet en général, bonne technique d'enseignement, m'a beaucoup servi lors des entretiens d'embauche.  J'espère po...",Computer Science,Beginner,4.59,17,Coursera,https://www.coursera.org/learn/java-poo
java-programming,Java Programming,I struggled doing the exercises Good course for new programmer.  Enough exercise for basic programming though isn't what I am looking for.  This was an intresting course full of many things to learn I...,Computer Science,Beginner,4.34,201,Coursera,https://www.coursera.org/learn/java-programming
java-programming-arrays-lists-data,Java Programming Arrays Lists Data,"Pros: The tutors are well prepared for the course! I can see their enthusiasm!The content is very online-learning oriented. Cons: As a person who is already familiar with programming, the material dev...",Computer Science,Beginner,4.7,99,Coursera,https://www.coursera.org/learn/java-programming-arrays-lists-data
java-programming-design-principles,Java Programming Design Principles,"best Great courses and great instructions! Easy to follow in most cases, great coding exercises and outstanding organization of the contents delivered.  Highly recommended.  This nicely packaged cours...",Computer Science,Beginner,4.65,66,Coursera,https://www.coursera.org/learn/java-programming-design-principles
java-programming-recommender,Java Programming Recommender,"it was another nice exercise Really enjoyed this project and I think it did a good job bringing the whole specialization together.  Personally, I took more autonomy on how to solve the problems but I ...",Computer Science,Beginner,4.69,26,Coursera,https://www.coursera.org/learn/java-programming-recommender
javascript,The,"This course provides a good introduction to Javascript.  The lectures are very easy to follow.  Very good course, though a bit difficult to grasp the concept in only a few weeks time",Computer Science,Beginner,4.55,359,Coursera,https://www.coursera.org/learn/javascript
jazz-improvisation,Jazz Improvisation,It was productive and interesting time.  I learnt a lot of new things and got much fun improving my improvisation skills. Cite from course: You will have plenty to keep you busy in the months ahead,Computer Science,Beginner,4.81,126,Coursera,https://www.coursera.org/learn/jazz-improvisation
jerusalem,The,"La historia cuando es contada de forma amena, te permite un viaje al pasado y en ese viaje revisar los errores y aciertos que permanece en nuestro diario hacer.  La historia no es solo conocimiento ad...",Computer Science,Beginner,4.19,21,Coursera,https://www.coursera.org/learn/jerusalem
jews-in-china,Jews In China,I am thoroughly enjoying this course and I've learned so much! I had no idea that there were Jews in China and that so many fled there as a result of persecution in other countries.  This has opened m...,Computer Science,Advanced,4.27,33,Coursera,https://www.coursera.org/learn/jews-in-china
ji-chu-guang-xue,Ji Chu Guang Xue,帮助很大。感谢老师们的付出！ Great ! I enjoy this trip for Optics! 老師教得很棒，上課方式有趣不無聊，每一次上課的內容都很有知識價值也具啟發性，還會常常作實驗驗證理論正確性，實在上得很過癮！ Very fundamental and solid introduction to basic optics.  很好 除了教導知識之外，還有更多對於求學知識態度養成，...,Computer Science,Beginner,4.89,9,Coursera,https://www.coursera.org/learn/ji-chu-guang-xue
jian-ji,Jian Ji,不太好 看了第一周，不准备再上下去了。原因有三：一：本来很简单的概念要专门用一个课题讲，显得很啰嗦。二：总的风格是现在到处都有的小清新风格，缺乏创新性。三：某些程度上更像是复旦大学的宣传片。 非常喜欢 很好的教材方式！谢谢！ 老师讲的很精彩 好 非常不错,Computer Science,Intermediate,4.14,7,Coursera,https://www.coursera.org/learn/jian-ji
jianzhu-zixun-jianmo,Jianzhu Zixun Jianmo,good 这门课程让我从较高角度认识了BIM技术和应用，BIM是建筑设计和施工的未来，是科技的顺其自然发展而来的产物，值得继续学下去！ 老師講的很詳細，謝謝老師！ 很好的入门课程，理论与实操相结合，加深了本人对于bim各种概念的理解 很不错，台大的讲授很好 谢教授团队讲述的BIM概念很到位，从中学习到很多知识。继续学习BIM，为未来的转型做好准备。 It's a very good introdu...,Computer Science,Beginner,4.67,9,Coursera,https://www.coursera.org/learn/jianzhu-zixun-jianmo
jiegou-fangcheng-moxing,Jiegou Fangcheng Moxing,非常适合有一定生物统计学基础的SEM初学者，能够帮助建立SEM的大体框架并解决常见的一些问题。 从实际应用出发，没有太多数学方面的困扰 单打独斗地学完了侯老师的SEM课程，虽然考试通过了，但还需要自己哦反复的练习和琢磨，才能更系统稳固地掌握SEM方法 课程很棒！教给我很重要的技能。 非常好 陆生学习会有语言障碍，，，，，，，，，，，，，，，，，，，，， I'll have to wait for ...,Computer Science,Beginner,4.93,14,Coursera,https://www.coursera.org/learn/jiegou-fangcheng-moxing
jisuanji-biancheng,Jisuanji Biancheng,"excellent lessens, excellent teacher 李老师的课是男票介绍来的~~说他人很和蔼，也参加表演节目什么的，是真心疼爱学生的、非常好的老师。开场的视频很爱！！大家都来听啊~我这种纯纯文科女都津津有味！！！ 好！ 讲的很好，题目难度也适中，很喜欢。 挺好的课程，不过作业对于新手来说可能有点难，并且作业和该周的课程关联系不是很大 很好的课程，只是很抱歉前段时间太忙了，拖了...",Computer Science,Beginner,4.73,217,Coursera,https://www.coursera.org/learn/jisuanji-biancheng
jisuanji-caozuo-xitong,Jisuanji Caozuo Xitong,"教授有实例，只是讲得不够详细易懂 非常好的课程，骆老师教的很棒！ 实例很少，没有实践环节，没有教案或笔记可供查阅，许多知识点未能详细解释，整体知识框架比较混乱。 很好的教学视频 还ok，比较有用 骆教授的课很有趣，特别是幻灯片做得非常棒，也不缺乏幽默感与亲和感。 挺好的, 可能自己基础不好听得比较吃力,但是教授讲的还是不错的 比较易懂的吧，基本涵盖，配合教材学习蛮不错的。 感觉老师讲的很不错，很清...",Computer Science,Intermediate,4.33,27,Coursera,https://www.coursera.org/learn/jisuanji-caozuo-xitong
jisuanji-wangluo,Jisuanji Wangluo,"非常适合想了解、学习计算机网络、计算机体系的非专业人士 操作系统和网络两章很有启发性最后一章讲office的不应该出现在这门课里 Easy to understand, but I just cannot recall too much half a year after finished it!Maybe it is a little bit superficial.  系统，全面 Just a...",Computer Science,Beginner,3.17,6,Coursera,https://www.coursera.org/learn/jisuanji-wangluo
jisuanji-xitong,Jisuanji Xitong,一开始我打了三星，后来决定改成五星，仔细想了一下，这门课还是很不错的，讲的很细，但是可能是不太适应mooc这个平台。具体表现形式为1. 内容非常多，难以消化2. 作业设置不能保证学习效果特别是第二点。习惯了上mooc的我非常不习惯。对于第一点来说的话。如果时间充足。可以一点一点看。时间不充足的话。最好是只看自己需要的部分。要不然会非常头疼的 参照CSAPP学习 看《深入理解计算机系统》看不懂的时候...,Computer Science,Intermediate,4.86,7,Coursera,https://www.coursera.org/learn/jisuanji-xitong
jisuanji-zucheng,Jisuanji Zucheng,"Through this course I've got to know about the basic organization of computer and how CPU works, as well as hierarchy of storage, I/O devices and interruptions.  I've got a better comprehension of how...",Computer Science,Beginner,4.73,33,Coursera,https://www.coursera.org/learn/jisuanji-zucheng
journalism,The,Really Amazing teachers.  Thankyou very much Very helpful.  I am glad to take this course and get the opportunity to learn new things and to review things I have not seem in years,Computer Science,Beginner,4.85,184,Coursera,https://www.coursera.org/learn/journalism
journalism-skills,Journalism Skills,"Good video lectures, pointless assignments .  Well organized.  Interactive",Computer Science,Intermediate,4.0,4,Coursera,https://www.coursera.org/learn/journalism-skills
journey-knowledge-action,Journey Knowledge Action,Amazing! Hope-Full! and Life Affirming! The New Universe Story is a collective call to action to learn about our deep cosmic past and our interconnected and interdependent role in the web of life.  We...,Arts & Design,Advanced,5.0,7,Coursera,https://www.coursera.org/learn/journey-knowledge-action
journey-of-the-universe,Journey Of The Universe,"A great course for everyone.  Provides inspiring insights into the workings of the universe, evoking a big picture understanding of how we fit into a beautiful story of our universe, a story that each...",Computer Science,Beginner,4.54,26,Coursera,https://www.coursera.org/learn/journey-of-the-universe
juegos-3d,Juegos 3D,"Muy buen curso excelente Buen curso y te explica bien, yo no tenia conocimiento y he aprendido mas! thank you! Muy buen explicado.  Este curso me abrió las puertas a algo que yo adoro y son los video ...",Computer Science,Intermediate,5.0,5,Coursera,https://www.coursera.org/learn/juegos-3d
julia-programming,Julia Programming,Good! But it's kind of easy.  Julia is a great language to learn.  It is fast! Julia is my future core language,Computer Science,Beginner,4.19,21,Coursera,https://www.coursera.org/learn/julia-programming
k-12-education,K 12 Education,I have learned a lot from this course.  G I was amazed by the depth of the subject.  The instructor did a great job simplifying the broad topics and pointing to what is most important,Education,Advanced,4.4,20,Coursera,https://www.coursera.org/learn/k-12-education
k-12-online-education,K 12 Online Education,"Amazing experience to learn from Coursera Great very nice,thanks! Useful and practical information based on research and current trends.  A must for anyone who teaches online courses, provides online ...",Education,Intermediate,5.0,4,Coursera,https://www.coursera.org/learn/k-12-online-education
kamni,Kamni,"Потрясающий курс! Очень доступно и интересно! Курс очень познавательный.  Все очень логично, последовательно и доступно для понимания.  Проходится на одном дыхании",Computer Science,Intermediate,5.0,15,Coursera,https://www.coursera.org/learn/kamni
kangjunyao-chaojixijun,Kangjunyao Chaojixijun,内容详实，授课准确 内容详实准确，受益匪浅。,Computer Science,Intermediate,5.0,2,Coursera,https://www.coursera.org/learn/kangjunyao-chaojixijun
kennedy,Kennedy,"I enjoyed the course and the book very much.  Kennedy's life, presidency, and legacy is a fascinating topic in modern American political history, and Professor Sabato took an interesting approach to i...",Computer Science,Beginner,4.57,53,Coursera,https://www.coursera.org/learn/kennedy
khanacademy,Muito,"O curso é incrível, o material é bem completo, te faz refletir sobre o ensino-aprendizagem de tal forma que você se fascina pelo ato de ensinar. O ensino híbrido deveria ser adicionado como parte da g...",Computer Science,Beginner,4.75,16,Coursera,https://www.coursera.org/learn/khanacademy
kierkegaard,Kierkegaard,"Excellent course, most especially for the professor, whose lucid, well-cadenced lectures were more interesting and comprehensible than I would have thought before starting the class, given the subject...",Computer Science,Beginner,4.73,75,Coursera,https://www.coursera.org/learn/kierkegaard
kombinatorika-dlya-nachinayushchikh,Kombinatorika Dlya Nachinayushchikh,"Чудесный курс! Красивая математика и увлеченный преподаватель.  Всех учащихся настигнет катарсис, как и обещал лектор :)) Очень доступное изложение.  Не смотря на то, что это базовый курс, мне, как пр...",Computer Science,Beginner,4.86,66,Coursera,https://www.coursera.org/learn/kombinatorika-dlya-nachinayushchikh
kongzi,Kongzi,老师年轻但是讲的还是感觉挺有见地的 从本课程开始，让我对论语有更深入的了解，内容贯穿生活、学习和工作。谢谢老师的课程给我们的启蒙，受益匪浅。 通过对本课程的学习，受益匪浅，衷心感谢陆老师，也特别感谢课程团队的各位老师。祝大家工作顺利，治业有成。 这个课不能替代读原文，而且应该在对论语读过的情况下来听，多多读原文会好。推荐南怀瑾的《论语别裁》 通过这个课程可以对论语有一个初步的了解，课程老师能结合当...,Computer Science,Intermediate,4.2,5,Coursera,https://www.coursera.org/learn/kongzi
korean-economy,Korean Economy,"Great course.  Not only it gives the promised understanding of the korean economic developent, but Professor Lee speaks a great english, and he was able to explain economic terms and concept in such a...",Computer Science,Beginner,4.8,15,Coursera,https://www.coursera.org/learn/korean-economy
kuaisu-xuexi,Kuaisu Xuexi,非常不推荐这一门课程，因为报的人实在是太少，又还要求互评，所以根本完不成作业。而且实质内容也不是非常的好，只是说明了几种工具的用法，并没有讲什么实际的学习方法。如果真的希望学习一些好的学习方法，推荐 Learn how to learn 这门课程 四大工具非常实用，是当下互联网时代应该人人掌握的方法。 有收获，主要介绍了信息获取、处理、管理等能力，集中讲解了搜索引擎（google），电子笔记（wi...,Data Science,Intermediate,4.32,25,Coursera,https://www.coursera.org/learn/kuaisu-xuexi
kunqu-opera,Kunqu Opera,"真正大家风范 昆曲之美，始于曲牌、唱腔、剧本、舞台表现等眼耳鼻舌身意，终于其中所感所得之色身香味触法 课程设计很好，每个视频都在10分钟左右，不觉疲劳，有一种意犹未尽的感觉。介绍了昆曲中的入门知识，各位老师有深深的人格魅力，为自己的事业奉献，尤其侯少奎老师让人印象深刻。 very thorough examination of the beauty of Kunqu opera, a real e...",Arts & Design,Beginner,4.94,17,Coursera,https://www.coursera.org/learn/kunqu-opera
lancer-startup,Lancer Startup,je suis un jeune ingénieur en camerounais en génie logiciel.  Ce cours m'a permis de bien comprendre le monde de entrepreneuriat.  Je tiens a félicité ces deux profs qui ont brillamment donné ce cours,Computer Science,Intermediate,4.12,8,Coursera,https://www.coursera.org/learn/lancer-startup
language-theories,Language Theories,It gives a very wide panorama of how language learning has been seeing along the times.  Above all it makes us to think critically about methodology and approach depending on the context we and the le...,Computer Science,Beginner,4.82,366,Coursera,https://www.coursera.org/learn/language-theories
latex,The,"Азы я знал и раньше.  Но этот курс заставил меня освоить много вещей, которые оказались для меня очень полезными.  Курс несмотря на легкомысленное и «ненаучное» название требует для прохождения серьез...",Computer Science,Intermediate,4.85,26,Coursera,https://www.coursera.org/learn/latex
lavenir-de-la-decision,Lavenir De La Decision,Ce cours nous permet de prendre beaucoup de recul et de hauteur sur notre manière d'aborder les décisions et notamment sur la manière de distinguer la complexité dans le monde qui nous entoure.  Très ...,Computer Science,Beginner,4.7,64,Coursera,https://www.coursera.org/learn/lavenir-de-la-decision
law-student,Law Student,"This course was required by my director, but it is not for those who have no background in law (which was the case for the group of us at CDC who were required to take this).  It was very difficult to...",Education,Beginner,4.62,90,Coursera,https://www.coursera.org/learn/law-student
leadership-21st-century,Leadership 21St Century,"I think some of the content was a bit repetitive, and the time estimates of how long it will take to complete a section was way off (often the reading and videos in one section would actually take 3 h...",Business,Intermediate,4.9,30,Coursera,https://www.coursera.org/learn/leadership-21st-century
leadership-challenge,Leadership Challenge,It was a wonderful and life changing experience for me.  Gratitude to Dr.  Valerie Gauthier and the team,Computer Science,Intermediate,4.75,4,Coursera,https://www.coursera.org/learn/leadership-challenge
leadership-coaching,Leadership Coaching,¡Muy bueno! I loved this course! There was so much to learn! Super great content! Loving it.  I am really sorry that a course with such a good content is ruined by the unrealistic assignement of week ...,Arts & Design,Intermediate,4.11,18,Coursera,https://www.coursera.org/learn/leadership-coaching
leadership-collaboration,Leadership Collaboration,So far this is the best on-line course I have attended about leadership.  The course is both challenging and you can utilize and put into practic This course contains many very practical ideas and met...,Business,Beginner,4.83,156,Coursera,https://www.coursera.org/learn/leadership-collaboration
leadership-development-planning,Leadership Development Planning,"Excellent experience, highly recommend these certificate.  I'll definitively continue with the Engineering Management Professional Certificate.  The instructions for assignment are not clear",Business,Intermediate,4.25,4,Coursera,https://www.coursera.org/learn/leadership-development-planning
leadership-skills,Leadership Skills,"Excellent course with really makes you more self aware and self assured, while being able to rely on others more and through that perform as a team.  Liked the converstaions I've just wasted 2 hours g...",Computer Science,Beginner,4.45,161,Coursera,https://www.coursera.org/learn/leadership-skills
leadership-socialinfluence,Leadership Socialinfluence,"Thoroughly enjoyed the course! Excellent course! The course contents and arrangement of topics are easy to understand.  Overall, the course provides useful information and a great framework through wh...",Business,Beginner,4.35,49,Coursera,https://www.coursera.org/learn/leadership-socialinfluence
leadership-storytelling,Leadership Storytelling,This course has remodeled and repackaged me.  Overall this course was very shallow and only touched the surface on the matters discussed.  The professors refrained to only mention a few cases of how c...,Computer Science,Beginner,4.23,71,Coursera,https://www.coursera.org/learn/leadership-storytelling
leading-organizations,Leading Organizations,Even more usefull concept to apply SR on an organizational level! Very helpful course indeed.  Extremely practical and helpful.  I will recommend this course to everyone! This MOOC is probably a bit t...,Computer Science,Intermediate,4.78,27,Coursera,https://www.coursera.org/learn/leading-organizations
leading-sense,Leading Sense,Course did teach me really deep lessons about myself and how I relate to others.  Very much educative course Thank you for this opportunity.  I am excited to be part of this Leadership Course,Business,Advanced,4.66,38,Coursera,https://www.coursera.org/learn/leading-sense
leading-teams,Leading Teams,"A very interesting course.  Amazing course, certainly made me more aware of myself, and others.  It will play a big role in my life, in how i approach things, and have positive impact",Business,Advanced,4.78,90,Coursera,https://www.coursera.org/learn/leading-teams
leading-teams-project,Leading Teams Project,I really enjoyed taking this course.  Especially the interviews with business leaders were helpful for me because it showed me how strategies and practices were applied in the business world.  Nice Co...,Business,Advanced,4.5,20,Coursera,https://www.coursera.org/learn/leading-teams-project
